{
  "noumenal": true,
  "version": 1,
  "repo": "noumenal-ai/noumenal_agent",
  "cards": [
    {
      "order": 12,
      "ingredient": "agents",
      "title": "noumenal_agent",
      "repo": "noumenal-ai/noumenal_agent",
      "vis": "private",
      "status": "active",
      "alsoIn": "",
      "direction": "AI that runs operations: actions are the output, multimodal data (multivariate time series plus video) is the input, and process and control understanding is the substrate. The bar is important actions done at high accuracy and usefulness.",
      "note": "Private production monorepo; the runtime drives ingest, run, poll, and steer flows end to end.",
      "tbd": false,
      "witnesses": [],
      "author": "Amit Timalsina \u00b7 Ayush Mittal"
    }
  ]
}