{
  "noumenal": true,
  "version": 1,
  "repo": "noumenal-ai/causal-worlds",
  "cards": [
    {
      "order": 9540,
      "alsoIn": "",
      "note": "Published on PyPI with CI; MIT licensed.",
      "tbd": false,
      "witnesses": [],
      "status": "active",
      "ingredient": "knowledge",
      "title": "causal-worlds",
      "repo": "noumenal-ai/causal-worlds",
      "vis": "open",
      "author": "Amit Timalsina",
      "direction": "Turn a plain-language description of an operation into a fictional but coherent causal world with a declared ground-truth causal graph, then benchmark whether a causal-discovery method can recover it. Because the structure is declared, not learned, every generated world is an answer key."
    }
  ]
}